{
  "$schema": "https://json-schema.org/draft/2020-12/schema",
  "$id": "https://ambient-mirror.local/contracts/hypothesis.schema.json",
  "title": "Hypothesis",
  "type": "object",
  "required": [
    "event_type",
    "region",
    "confidence",
    "evidence_ids",
    "reason",
    "alternatives",
    "limitations"
  ],
  "properties": {
    "event_type": {
      "type": "string",
      "minLength": 1
    },
    "region": {
      "type": "string",
      "minLength": 1
    },
    "confidence": {
      "type": "number",
      "minimum": 0,
      "maximum": 1
    },
    "evidence_ids": {
      "type": "array",
      "items": {
        "type": "string",
        "minLength": 1
      }
    },
    "reason": {
      "type": "string"
    },
    "alternatives": {
      "type": "array",
      "items": {
        "type": "object",
        "required": [
          "event_type",
          "confidence"
        ],
        "properties": {
          "event_type": {
            "type": "string"
          },
          "confidence": {
            "type": "number",
            "minimum": 0,
            "maximum": 1
          }
        }
      }
    },
    "limitations": {
      "type": "array",
      "items": {
        "type": "string"
      }
    }
  },
  "description": "Bounded final hypothesis. event_type 'unknown' (with region 'unknown' allowed) is the abstain path. evidence_ids must reference EvidenceBundle evidence ids."
}
